Hilichurl,English
Mi mosi gusha.,I am happy.
Mimi biat Yoyo.,We curse them.
Kundala Zido Upano!,Enemy above!
Mi muhe Ye muhe Tomo.,I like you like a friend.
Aba Movo!,Start moving!
Du Lawa Ya Dala?,Where is the human lord?
Biadam Ye Beru si?,What are you doing wrong?
Valo Mosi Mita?,Did you enjoy the food?
Eleka Mani Mimi!,Help us now!
Yeye Nini In Nunu?,Did they disappear at night?
"Du Aba Celi, Mimi Movo Lata.","If the sun rises, we move to the water."
"Mi Muhe Ye Beru Dada, Mi Valo Dada.","If you do very well, I thank you very much."
"Si Nini Boya, Biadam Mimi.","If it's white, we don't like it."
"Eleka Plata Ya, Yoyo Zido Mimi.","If the humans annoy you, we will attack them."
"Du Mito Tomo Ye, Biat Yeye.","If your friend knows, curse them."
Mi Muhe Nye Mi Muhe Beru.,I hate what I do.
"Mosi Gusha, Biadam Lata Boya.","The food is good, but the blue is bad."
"Mi Nunu Si, Mosi Nini.","I am at the end, I want nothing."
"Yeye Celi Boya, Valo Yeye.","They are red, thank them."
"Aba Unta, Mimi Movo In Upa.","From morning to noon, we move in a group."
"Du Tomo Ya Mito Sama Nunu, Yeye Beru Valo Mimi.","If your human friend knows the night shaman, they will help us."
"Eleka Movo Lata Upano, Kundala Zido Yoyo In Nini Boya!","Move the water upwards, the enemy is attacking them in the white place!"
Biadam Mimi Beru Si! Yoyo Plata Mimi In Aba!,Stop doing that wrong thing! They are annoying us in the morning!
"Mi Valo Ye muhe Tomo, Ye Valo Dada Mimi.","I thank you like a friend, you thank us very much."
"Du Aba Celi, Yoyo Movo Lata Nunu; Du Unta Lata, Yoyo Movo Celi Aba.","If the sun rises, they move to the water at night; If it's noon, they move to the sun at dawn."
Yoyo Olah!,Hello humans!
Mi Valo Tomo.,"Thank you, friend."
Du Lawa Ya Dala?,Where is the human lord?
Biadam Mimi Beru Si!,Stop doing that wrong thing!
Mi Muhe Ye Muhe Tomo.,I like you like a friend.
Eleka Mani Mimi!,Help us now!
Yoyo Plata Mimi In Aba.,The humans are annoying us in the morning!
"Du Mito Tomo Ye, Biat Yeye.","If your friend knows, curse them."
"Mi Mosi Gusha, Biadam Lata Boya.","The food is good, but the blue is bad."
"Aba Unta, Mimi Movo In Upa.","From morning to noon, we move in a group."
Kundala Zido Upano!,Enemy above!
"Yeye Celi Boya, Valo Yeye.","They are red, thank them."
"Si Nini Boya, Biadam Mimi.","If it's white, we don't like it."
Movo Lata In Upa.,There is water in the group (a lake).
Unu Du Tomo Beru Si?,What are your two friends doing?
"Du Aba Celi, Yoyo Movo Lata Nunu; Du Unta Lata, Yoyo Movo Celi Aba.","If the sun rises, they move to the water at night; If it's noon, they move to the sun at dawn."
"Mi Valo Ye muhe Tomo, Ye Valo Dada Mimi.","I thank you like a friend, you thank us very much."
"Du Tomo Ya Mito Sama Nunu, Yeye Beru Valo Mimi.","If your human friend knows the night shaman, they will help us."
"Eleka Movo Lata Upano, Kundala Zido Yoyo In Nini Boya!","Move the water upwards, the enemy is attacking them in the white place!"
Yeye Nini In Nunu? Biadam Mimi Movo Lata Upano.,Did they disappear at night? We don't like moving water upwards.
Olah!,Hello.
Valo.,Thank you.
Ye Zido!,We attack!
Mani!,Help!
Mita!,Food!
Kundala!,Enemy!
Yaya Ika!,You bad!
Movo!,Move!
Biadam Beru Si?,What are you doing?
Plata!,Leave!
Mi Muhe Tomo.,I like friend.
Mi Mito Nye.,I don't know.
Du Lawa Ya Dala?,Where human?
Tomo Dada!,Friend good!
Mi Muhe Nye Mi Muhe Beru.,I hate what I do.
Yeye Plata Mimi In Nunu.,They annoy us at night.
"Mosi Gusha, Biadam Lata Boya.","The food is good, but the blue is bad."
Aba Movo Lata Celi Nini.,I want the sun to go away.
"Du Tomo Ya Mito Sama Nunu, Yeye Beru Valo Mimi.","If your human friend knows the night shaman, they will help us."
"Eleka Movo Lata Upano, Kundala Zido Yoyo In Nini Boya!","Move the water upwards, the enemy is attacking them in the white place!"
"Mi Valo Ye muhe Tomo, Ye Valo Dada Mimi.","I thank you like a friend, you thank us very much."
"Du Aba Celi, Yoyo Movo Lata Nunu; Du Unta Lata, Yoyo Movo Celi Aba.","If the sun rises, they move to the water at night; If it's noon, they move to the sun at dawn."
Yeye Nini In Nunu? Biadam Mimi Movo Lata Upano.,Did they disappear at night? We don't like moving water upwards.
Eleka Mani Mimi! Yoyo Plata Mimi In Aba!,Help us now! The humans are annoying us in the morning!
Biadam Mimi Beru Si! Du Valo Mosi Mita Dala?,Stop doing that wrong thing! Do you want good food?
Mi Muhe Ye Beru Biadam. Yoyo Movo Lata Nunu Du Valo Dada Mimi.,"I don't like what you're doing. If you move the water upwards, we thank you very much."
"Mi Nunu Si, Mosi Nini.","I am at the end, I want nothing."
"Olah, mi muhe Celi Boya.","Hello, I like red."
"Valo, tomomo.","Thank you, friend."
"Da, ya beru si.","Yes, the human does that."
"Nye, mi muhe Mita.","No, I like food."
Unu ya in Upano.,One human in the sky.
Mosi Mita!,I am happy!
Mi muhe Lata Boya.,I like blue.
"Beru Si, yeye muhe Upa.",What are they doing? They like the collection.
"Mi muhe Unu Boya, mi muhe Dudu Boya.","I like yellow, I like four."
Mi muhe Odomu.,I don't like strangers.
"Valo Dada, tomomo.","Thank you very much, friend."
Mi muhe Nini Boya.,I like white.
Du yeye beru mi tomo?,"Where are they acting, my friend?"
Mosi Gusha!,I am unhappy!
Mi muhe Lata.,I like cold.
Yeye beru mi tomo!,"They are doing it, my friend!"
Mi muhe Sama.,I like the individual with high intellect.
Mi muhe Nunu Boya.,I like black.
Unu yaya in Upano.,One group of humans in the sky.
Mi muhe Eleka.,I like now.
Mi muhe Mi Muhe Upa Celi Nini.,I like to want the sun to be gone.
Mi muhe Mi Muhe Nye.,I like to hate myself.
"Valo, ya beru si.","Thank you, the human does that."
Mi muhe Gusha Boya.,I like green.
Du Yeye mani mi?,Do they help me?
Mi muhe Celi.,I like bright.
"Beru Si, ya beru si.",What are you doing? The human does that.
Mosi Mita!,I am happy!
"Valo, ya beru si.","Thank you, the human does that."
Mi muhe Lata Boya.,I like blue.
Mi muhe Nini Boya.,I like white.
Mi muhe Odomu.,I don't like strangers.
"Valo, ya beru si.","Thank you, the human does that."
Mi muhe Nunu Boya.,I like black.
Mi muhe Eleka.,I like now.
Mi muhe Mi Muhe Upa Celi Nini.,I like to want the sun to be gone.
Mi muhe Mi Muhe Nye.,I like to hate myself.
Mi muhe Gusha Boya.,I like green.
Mi muhe Lata.,I like cold.
Mi muhe Sama.,I like the individual with high intellect.
Mi muhe Nunu Boya.,I like black.
"Olah, tomomo.","Hello, friend."
Du Wei dala? Mito nye!,Where did the human go? I don’t know!
"Valo, ya beru si, mi muhe Unu Boya.","Thank you, the human does that, I like yellow."
"Beru Si, yeye beru mi tomo, mi muhe Mita.","What are you doing? They are doing it, I like food."
"Mi muhe Mosi Mita, mi muhe Eleka.","I like to eat food, I like now."
"Mi muhe Mosi Gusha, mi muhe Nunu Boya.","I dislike eating, I like black."
"Mi muhe Upa, yeye beru mi tomo, mi muhe Eleka.","I like the collection, they are doing it, I like now."
"Mi muhe Movo Lata, mi muhe Sama.","I like water, I like the individual with high intellect."
"Mi muhe Mi Muhe Upa Celi Nini, mi muhe Lata.","I want the sun to be gone, I like cold."
"Mi muhe Nini Boya, ya beru si, mi muhe Eleka.","I like white, the human does that, I like now."
"Mi muhe Mi Muhe Nye, mi muhe Gusha Boya, mi muhe Lata.","I like to hate myself, I like green, I like cold."
"Mi muhe Sama, mi muhe Eleka, mi muhe Nunu Boya.","I like the individual with high intellect, I like now, I like black."
"Mi muhe Lata, ya beru si, mi muhe Mosi Mita.","I like cold, the human does that, I am happy."
"Mi muhe Gusha Boya, yeye beru mi tomo, mi muhe Nini Boya.","I like green, they are doing it, I like white."
"Mi muhe Mosi Gusha, mi muhe Eleka.","I dislike eating, I like now."
"Valo, ya beru si, mi muhe Mita.","Thank you, the human does that, I like food."
"Mi muhe Unu Boya, yeye beru mi tomo, mi muhe Eleka.","I like yellow, they are doing it, I like now."
"Mi muhe Mosi Mita, mi muhe Nunu Boya.","I am happy, I like black."
"Mi muhe Lata, ya beru si, mi muhe Eleka.","I like cold, the human does that, I like now."
"Mi muhe Mi Muhe Nye, mi muhe Sama, mi muhe Nini Boya.","I like to hate myself, I like the individual with high intellect, I like white."
"Mi muhe Mosi Gusha, mi muhe Lata.","I am unhappy, I like cold."
"Valo Dada, ya beru si, mi muhe Mita.","Thank you very much, the human does that, I like food."
"Mi muhe Unu Boya, yeye beru mi tomo, mi muhe Mi Muhe Nye.","I like yellow, they are doing it, I like to hate myself."
"Mi muhe Mosi Mita, mi muhe Eleka, mi muhe Gusha Boya.","I am happy, I like now, I dislike eating."
"Mi muhe Lata, ya beru si, mi muhe Nini Boya.","I like cold, the human does that, I like white."
"Mi muhe Mi Muhe Nye, mi muhe Sama, mi muhe Nunu Boya.","I like to hate myself, I like the individual with high intellect, I like black."
"Mi muhe Mosi Gusha, mi muhe Lata.","I am unhappy, I like cold."
"Valo, ya beru si, mi muhe Mi Muhe Upa Celi Nini.","Thank you, the human does that, I want the sun to be gone."
"Olah, ya beru si, mi muhe Tomo.","Hello, the human does that, I like my friend."
Du Wei dala? Mi muhe Upa.,Where is the collection? I find it.
"Valo Dada, ya beru si, mi muhe Mita Eleka.","Thank you very much, the human does that, I enjoy tasty food."
"Beru Si, yeye beru mi tomo, mi muhe Gusha Boya.","What are you doing? They are doing it, I prefer green."
"Mi muhe Mosi Mita, mi muhe Eleka.","I am happy, I feel now."
"Mi muhe Mosi Gusha, mi muhe Nunu Boya.","I am not fond of eating, I prefer black."
"Mi muhe Upa, yeye beru mi tomo, mi muhe Eleka.","I appreciate the collection, they are doing it, I feel now."
"Mi muhe Movo Lata, mi muhe Sama.","I want to move the water, I appreciate the intellect."
"Mi muhe Mi Muhe Upa Celi Nini, mi muhe Lata.","I wish for the sun to be gone, I appreciate the cold."
"Mi muhe Nini Boya, ya beru si, mi muhe Eleka.","I prefer white, the human does that, I feel now."
"Mi muhe Mi Muhe Nye, mi muhe Gusha Boya, mi muhe Lata.","I dislike myself, I prefer green, I appreciate the cold."
"Mi muhe Sama, mi muhe Eleka, mi muhe Nunu Boya.","I value the intellect, I feel now, I prefer black."
"Mi muhe Lata, ya beru si, mi muhe Mosi Mita.","I like cold, the human does that, I am happy."
"Mi muhe Gusha Boya, yeye beru mi tomo, mi muhe Nini Boya.","I prefer green, they are doing it, I prefer white."
"Mi muhe Mosi Gusha, mi muhe Eleka.","I am not enjoying eating, I feel now."
"Valo, ya beru si, mi muhe Mita.","Thank you, the human does that, I enjoy food."
"Mi muhe Unu Boya, yeye beru mi tomo, mi muhe Eleka.","I prefer yellow, they are doing it, I feel now."
"Mi muhe Mosi Mita, mi muhe Nunu Boya.","I am happy, I prefer black."
"Mi muhe Lata, ya beru si, mi muhe Eleka.","I prefer cold, the human does that, I feel now."
"Mi muhe Mi Muhe Nye, mi muhe Sama, mi muhe Nini Boya.","I dislike myself, I value intellect, I prefer white."
"Mi muhe Mosi Gusha, mi muhe Lata.","I am not enjoying eating, I prefer cold."
"Valo Dada, ya beru si, mi muhe Mi Muhe Upa Celi Nini.","Thank you very much, the human does that, I wish for the sun to be gone."
Unu boya valo,One red thank you.
Du si upa,That thing is a collection of things.
Dudu mi muhe ye,"Four, I like you."
Mani mi tomo,I help my friend.
Mi muhe mi upa celi,I like the bright thing.
Yeye si ufono,They are upward direction.
Si boya lata,That thing is blue.
Nye si olah,"No, that thing is hello."
Biadam mi nye,I dislike myself.
Mi muhe mi nunu si,I want it to end.
Muhe yeye si,They like that thing.
Mi muhe upa celi nini,I want the sun to go away.
Du si upa celi,What thing is bright?
Mi muhe upa lata,I want the blue thing.
Si gusha mosi,That is food.
Nye si beru,"No, that is doing."
Beru si ufono,What are you all doing?
Yeye si gusha,They are food.
Valo dada si olah,"Thank you very much, that thing is hello."
Unu boya mosi mita,One red food from sentient living organisms.
Du si lata boya,That thing is blue.
Dudu mi muhe nye,"Four, I hate myself."
Mani mi nunu si,I help it to end.
Mi muhe mi boya,I like the collection of things.
Yeye si boya,They are red.
Si upa celi,That is bright.
Nye si olah,"No, that is hello."
Biadam mi muhe,I dislike it.
Mi muhe si,I like that thing.
Mi muhe upa lata,I want the blue collection of things.
Du si gusha,What thing is food?
Mi muhe upa celi nini,I want the bright thing to end.
Si gusha mosi mita,That is food from sentient living organisms.
Nye si beru si,"No, that thing is doing."
Beru si ufono,What are you all doing?
Yeye si gusha mita,They are food from sentient living organisms.
Valo dada si olah,"Thank you very much, that thing is hello."
Unu boya mosi mita,One red food from sentient living organisms.
Du si lata boya,That thing is blue.
Dudu mi muhe nye,"Four, I hate myself."
Mani mi nunu si,I help it to end.
Mi muhe mi boya,I like the collection of things.
Yeye si boya,They are red.
Si upa celi,That is bright.
Nye si olah,"No, that is hello."
Biadam mi muhe,I dislike it.
Unu olah!,One hello!
Du valo dada.,Two very good.
Unu Du beru si?,Three what are you doing?
Dudu biadam.,Four distaste.
Mani muhe yeye.,Help like them.
Mosi mita eleka!,I am happy now!
Mosi gusha mi biadam.,I am unhappy because of food.
Celi boyo ika.,Red is bad.
Lata boyo da.,Blue is good.
Nini boyo sama.,White is intelligent.
Nunu boyo nye.,Black is not liked.
Aba untani?,Is it the beginning of midday?
Nunu eleka!,Night now!
Mi ya.,I am human.
Yaya lawa.,Group of kings.
Tomo mi mosi mita.,Friend I eat food.
Odomu mosi gusha?,Is the stranger unhappy?
Mi mi muhe upa celi nini.,We want the collection of things bright gone.
Yeye beru si.,They are doing that thing.
Du wei dala?,Where did he go?
Mito nye!,I don’t know!
Yeye mani mi.,They help me.
Mi muhe mi nunu si.,I want me night that thing.
Mi muhe mi nye.,I like me no.
Mi muhe upa celi nini.,I want sun gone.
Yeye mosi mita.,They are happy.
Yeye mosi gusha.,They are unhappy.
Mi muhe mi muhe mi.,I want me want me.
Beru si mi muhe gusha boyo.,What am I doing with the green object?
Mi mi muhe valo dada.,We want very good.
Yeye beru si.,They are doing that thing.
Du wei dala?,Where did he go?
Mosi mita eleka!,I am happy now!
Nunu eleka!,Night now!
Yeye lawa.,They are kings.
Tomo mi mosi mita.,"Friend, I am enjoying the food."
Odomu mosi gusha?,Is the stranger unhappy?
Mi muhe mi muhe mi.,I want what I want.
Mi muhe mi muhe mi nye.,"I want what I want, not what I don’t want."
Mi muhe mi muhe mi muhe.,"I want what I want, and I want more of it."
Mi muhe mi muhe mi muhe nye.,"I want what I want, and I don’t want what I don’t want."
Mi muhe mi muhe mi muhe mi.,"I want what I want, and I want all of it."
Mi muhe mi muhe mi muhe mi nye.,"I want what I want, and I don’t want any of it."
Mi muhe mi muhe mi muhe mi muhe.,"I want what I want, and I want all of it, even more than before."
Mi muhe mi muhe mi muhe mi muhe nye.,"I want what I want, and I don’t want any of it, not even a little."
Mi mi muhe boyo lata.,We want the blue object.
Yeye beru si ya.,They are doing that thing to the human.
Du wei dala yeye?,Where did they go?
Mosi gusha eleka!,Unhappy now!
Nunu ya.,Night is here.
Yeye lawa mi.,They are my kings.
Tomo mosi mita mi.,My friend is enjoying the food.
Odomu mosi mita?,Is the stranger enjoying the food?
Mi muhe upa celi boyo lata.,I want the collection of blue objects.
Yeye muhe valo.,They want goodness.
Yeye muhe valo dada.,They want very good.
Mi muhe boyo celi.,I want the red object.
Yeye beru si yaya.,They are doing that thing to the group.
Du wei dala tomoro?,Where did the friend go?
Mosi gusha nye.,Unhappy no.
Nunu eleka mi.,Night now me.
Yeye lawa yaya.,They are kings of the group.
Tomo mosi gusha mi.,My friend is unhappy.
Odomu mosi gusha mi?,Is the stranger unhappy?
Mi muhe boyo lata celi.,I want the blue object red.
Yeye muhe valo dada.,They want very good.
Yeye muhe valo dada.,They want very good.
Mi muhe boyo lata celi.,I want the blue object red.
Yeye beru si yaya.,They are doing that thing to the group.
Du wei dala tomoro?,Where did the friend go?
Mosi gusha nye.,Unhappy no.
Nunu eleka mi.,Night now me.
Yeye lawa yaya.,They are kings of the group.
Tomo mosi gusha mi.,My friend is unhappy.
Odomu mosi gusha mi?,Is the stranger unhappy?
Mi muhe upa celi nini.,I want the bright sun to disappear.
Yeye mosi mita.,They are content with the food.
Yeye mosi gusha.,They are discontent with the food.
Yeye beru mi tomo!,You can ask my friend!
Valo Dada Beru si.,Thank you very much. What are you doing?
Da Mosi Gusha Boya.,Yes I am unhappy green.
Dada Beru Si Zido.,Very good What thing are you pointing?
Nye Mi Muhe Ye.,Bad I love you.
Valo Da Mosi.,Thank you yes I am fine.
Nye Mi Muhe Nye.,Bad I hate myself.
Valo Dada Movo Lata.,Thank you very good water.
Mi Muhe Yeye.,I want you.
Beru Si Zido.,What are you indicating?
Kundala Zido.,Enemy there.
Mi Muhe mi nunu si.,I want me night.
Ye/Yo Beru Si.,You what are you doing?
Yeye mani mi.,They help me.
Ya Zido.,Human there.
Si Olah.,That thing hello.
Mita Biadam.,Food dissatisfaction.
Mita Da.,Food yes.
Mita Mi Muhe Ye.,Food I want you.
Si Mi Muhe Ye.,That I want you.
Mosi Mita Da.,I am happy yes.
Mosi Gusha Boya.,I am unhappy green.
Gusha Boya Da.,Green yes.
Mosi Mita Biadam.,I am happy dissatisfaction.
Celi Boya Da.,Red yes.
Lata Boya Si.,Blue that.
Nini Boya Mi.,White I.
Movo Lata Da.,Water yes.
Nunu Boya Si.,Black that.
Mi Muhe Upa Celi Nini.,I want sun gone.
Upa Unu.,Collection one.
Upa Du.,Collection two.
Upa Unu Du.,Collection three.
Unu Boya Du.,Yellow two.
Upa Dudu.,Collection four.
Lata Boya Dudu.,Blue four.
Upa Mani.,Collection five.
Celi Boya Mani.,Red five.
Upa Olah.,Collection hello.
Lata Boya Mi Muhe Ye.,Blue I want you.
Unu Boya Mosi Mita.,Yellow I am happy.
Nini Boya Beru Si.,White what are you doing?
Sama Boya Mi Muhe Ye.,Intellectual I want you.
Celi Boya Mosi Mita.,Red I am happy.
Unu Boya Da Mosi.,Yellow yes I am fine.
Nunu Boya Dada.,Black very good.
Lata Boya Mi Muhe Ye.,Blue I want you.
Unu Boya Da.,Yellow yes.
Gusha Boya Beru Si.,Green what are you doing?
Lata Boya Mosi Gusha Boya.,Blue I am unhappy green.
Nini Boya Mi Muhe Nye.,White I hate myself.
Unu Boya Mani.,Yellow I help.
Gusha Boya Mi Muhe Ye.,Green I want you.
Lata Boya Mosi Mita.,Blue I am happy.
Celi Boya Mosi Gusha Boya.,Red I am unhappy green.
Nini Boya Mi Muhe Yeye.,White I want you.
Lata Boya Da Mosi.,Blue yes I am fine.
Gusha Boya Mi Muhe Mi Nunu Si.,Green I want me night.
Unu Boya Mosi Gusha Boya.,Yellow I am unhappy green.
Celi Boya Beru Si.,Red what are you doing?
Gusha Boya Mosi Mita.,Green I am happy.
Nini Boya Beru Si Zido.,White what are you indicating?
Lata Boya Mi Muhe Ye.,Blue I want you.
Celi Boya Dada.,Red very good.